subject,body
"Re: Q3 budget review meeting - agenda attached","Hi Sarah, thanks for sending over the draft. I have reviewed the numbers and added a few comments in the shared document. Could we move our Thursday meeting to 2pm? Best, Mark"
"FW: Pipeline capacity update from FERC","Team, please find attached the latest FERC bulletin on interstate pipeline capacity. We should discuss implications for our Q4 transport contracts in the Friday call."
"Daily standup notes - Tuesday","Notes from this morning standup: Alice is finishing the migration script, Bob is blocked on the staging environment, Carol will demo the new dashboard at 4pm. Reply if anything is missing."
"You have WON a $1,000,000 prize!!!","Dear Lucky Winner, CONGRATULATIONS!!! You have been selected as the GRAND WINNER of our international lottery. To claim your prize CLICK HERE NOW. Send us your bank details immediately."
"Code review request: PR #482","Could someone take a look at PR 482 when you get a chance? It is a small refactor of the auth middleware, no behavior changes expected. Tests are passing on CI."
"Your account will be suspended - verify now","We detected unusual activity on your account. To restore access please click the link below within 24 hours and confirm your password and credit card information. Failure to verify will result in permanent suspension."
"Re: Vendor invoice 2026-0418","Hi Tom, the invoice from Calpine looks correct on our end. I will route it through approval today, payment should clear by end of week. Let me know if you see any discrepancies."
"Hot single ladies in your area want to meet","Lonely tonight? Click here to chat with hot singles near you. Free signup, no credit card needed. Browse profiles and start chatting in seconds. Limited time offer."
"Welcome to the team, Jordan!","Please join me in welcoming Jordan Lee to the analytics team starting next Monday. Jordan comes from the Houston office and will be working on the risk reporting platform. Their desk is on the 14th floor."
"Cheap meds delivered to your door","Get prescription meds 80 percent off retail price, no doctor visit required. Viagra, Cialis, and many others available. Discreet shipping worldwide. Click here to order now."
"Reminder: timesheet due Friday EOD","Friendly reminder that timesheets for this pay period are due by Friday end of business. Please log your hours in Workday and submit for manager approval. Contact HR if you have any issues."
"Quick 2-minute survey - your feedback is appreciated","We are collecting feedback from users on the new reporting dashboard. The survey takes about two minutes. As a thank you, all participants will be entered into a drawing."
"Crypto investment opportunity - 300% returns guaranteed","Dear investor, our exclusive crypto fund is delivering 300 percent annual returns. Join now with a minimum deposit of just 500 USD. Limited spots available. Reply with your wallet address to get started."
"Conference call with Calpine team - Thursday 10am","Setting up a conference call with the Calpine team for Thursday at 10am to walk through the renewal terms. Dial-in details are in the calendar invite. Please review the contract draft beforehand."
"Re: Risk report numbers for September","I checked the variance you flagged - it traces back to a settlement adjustment posted on the 22nd, not a calculation error. Detailed breakdown is in the shared spreadsheet, tab 3."
"Free iPhone 15 Pro - claim yours today","You have been randomly selected to receive a brand new iPhone 15 Pro absolutely FREE. No purchase necessary. Just pay $4.99 shipping and handling. Click here to claim before stocks run out!"
"IT maintenance window this weekend","The IT team will perform scheduled maintenance on the trading systems this weekend, Saturday 8pm to Sunday 6am. Please save and close all work before leaving Friday. Email helpdesk for urgent access needs."
"Confirmation needed - please respond","Hi, we need your confirmation for next week's complimentary session. Please reply or click the link below to confirm. Spaces are limited and confirmations are first come first served."
"Re: Counterparty agreement pending signature","The master agreement with Calpine is awaiting your signature. Deadline for execution is end of business Friday. A copy is attached for reference. Contact legal if you have questions."
"URGENT: Tax refund of $2,847 awaiting your action","The Internal Revenue Service has approved your refund of 2847 USD. To receive the funds please verify your bank account information by clicking the secure link below within 48 hours."
"Project Atlas weekly update","Atlas is on track for the November release. Backend API frozen, frontend testing in progress, security review scheduled for next week. Two open risks documented in the tracker. Full report attached."
"Make $5,000 a week working from home!!!","Tired of your 9 to 5? Join thousands who are making 5000 USD per week from home with our proven system. No experience needed, start today with just 30 minutes a day. Click here for instant access."
"Re: Performance review prep","Hi Anna, attached is my self-assessment for the cycle along with the goals tracker. Happy to discuss in our 1:1 on Wednesday. Let me know if you need anything else from my side beforehand."
"Apple ID locked - immediate action required","Your Apple ID has been locked due to suspicious activity. Please verify your identity at the link below within 12 hours to avoid permanent account closure. Have your credit card ready for verification."
"Exclusive sponsorship - limited slots for our forum","We are reaching out regarding our upcoming industry forum. Sponsors receive prominent logo placement and exclusive access. Limited slots available - please respond by Friday to confirm your sponsorship."
"Weekly hiring update from People Ops","Three roles closed this week: Senior Analyst, Data Engineer, Risk Associate. Two offers pending acceptance. Pipeline for Q4 looking healthy with 14 candidates in final stages. Full report in the shared folder."
"Nigerian prince needs your help to transfer $10M","Dear Friend, I am Prince Adebayo and I need your urgent help to transfer 10 million USD out of my country. In exchange you will receive 30 percent. Please send your bank details and a copy of your passport."
"Re: Office relocation - phase 2 timeline","Phase 2 of the office relocation kicks off the first week of November. Affected teams have been notified, packing supplies will be delivered next Monday. FAQ document attached for any questions."
"Mortgage rates dropped - refinance and save thousands","Rates are at historic lows! You may qualify to refinance and save 400 USD per month. No upfront fees, free quote in 60 seconds. Click below to see how much you could save this year."
"Maintenance schedule for trading floor HVAC","Building services will be servicing the HVAC on the trading floor next Saturday between 6am and 10am. No impact on trading hours. Contact facilities if you experience any temperature issues afterward."
"Lonely Russian beauty wants to meet you","Hi handsome, my name is Anastasia and I saw your profile online. I am looking for a serious relationship with a kind man like you. Please reply with your photo so we can chat more. Kisses!"
"Re: Client meeting recap - Hess Energy","Good meeting yesterday. Summary: Hess wants to extend the storage agreement by 18 months at the current rate. They asked for two adjustments which I have noted in the action items. Next call Friday."
"Earn cash from home - no experience needed","Stay-at-home moms are making 3000 USD per week with this simple system! No selling, no calls, no experience. Just 1 hour a day from your phone. Spots filling fast - click here to apply now."
"Re: Annual holiday celebration December 14","Just confirming the December 14 holiday party is on. RSVP form is open until December 1. Catering and music are booked. Attached is the dietary preference survey for HR."
"Your PayPal account has been limited","We have temporarily limited your PayPal account due to recent activity. To restore full access, please log in via the secure link below and update your billing information within 72 hours."
"Re: Q4 forecast assumptions","Following up on yesterday - I updated the Q4 forecast model with the new commodity price deck and revised demand assumptions. Slight downward revision for December. Detailed deck attached for review."
"Save 80% on luxury watches - genuine Rolex replicas","Premium quality Rolex, Omega, and Tag Heuer replicas indistinguishable from the originals. 80 percent off retail. Free worldwide shipping on orders over 100 USD. Order today, ships tomorrow."
"FERC announces new pipeline regulation effective January","The Federal Energy Regulatory Commission has issued a final rule on interstate pipeline capacity allocation. The rule takes effect January 1 and may impact existing transportation agreements. Summary document attached."
"Effective weight loss pills - lose 20 pounds in 30 days","Doctors are stunned by this new weight loss formula. Customers are losing 20 pounds in just 30 days without diet or exercise. As seen on TV. Click here for our limited time 50 percent off offer."
"Re: New hire onboarding checklist","Hi Patrick, here is the onboarding checklist for Jordan starting Monday. IT has provisioned the laptop and accounts. Building badge will be ready at reception. Let me know if I missed anything."
